Zone,Division,School,Type,Students,Province,District,School_Type,Location
Wattegama,Pathadumbara,"Rathanajothi Maha Vidyalaya, Udatalawinna",1C,185.0,Central Province,Kandy District,Provincial schools,
Wattegama,Pathadumbara,"Pathadumbara Maha Vidyalaya, Menikhinna",1C,2100.0,Central Province,Kandy District,Provincial schools,
Wattegama,Pathadumbara,"Mahasen Maha Vidyalaya, Megodagama",1C,366.0,Central Province,Kandy District,Provincial schools,
Wattegama,Pathadumbara,"Samudradevi Balika Maha Vidyalaya, Nawayaltenna",1C,890.0,Central Province,Kandy District,Provincial schools,
Wattegama,Pathadumbara,"Kandy Model School, Palletalawinna",1C,1306.0,Central Province,Kandy District,Provincial schools,
Wattegama,Pathadumbara,"Jamiul Azhar Muslim Maha Vidyalaya, Udatalawinna",1C,1019.0,Central Province,Kandy District,Provincial schools,
Wattegama,Pathadumbara,"Al Safa Muslim Maha Vidyalaya, Polgolla",1C,287.0,Central Province,Kandy District,Provincial schools,
Wattegama,Pathadumbara,"Bharathi Tamil Maha Vidyalayam, Wattegama",1C,400.0,Central Province,Kandy District,Provincial schools,
Wattegama,Kundasale,"S.W.R.D Bandaranayaka National School, Kundasale",1C,730.0,Central Province,Kandy District,Provincial schools,
Wattgama,Panvila,"Kosgama Maha Vidyalaya, Madukele",1C,238.0,Central Province,Kandy District,Provincial schools,
Wattgama,Panvila,"Kandakattiya Tamil Maha Vidyalayam, Tawalantenna",1C,401.0,Central Province,Kandy District,Provincial schools,
Wattgama,Panvila,"Abirami Tamil Maha Vidyalayam, Kalabokka",1C,712.0,Central Province,Kandy District,Provincial schools,
Matale,Matale,"Vijaya College, Matale",1AB,2280.0,Central Province,Matale District,National schools,
Matale,Matale,"St. Thomas' College, Matale",1AB,2732.0,Central Province,Matale District,National schools,
Matale,Matale,"Christ Church College, Matale",1AB,2170.0,Central Province,Matale District,National schools,
Matale,Matale,"Sri Sangamitta Balika National School, Matale",1AB,3061.0,Central Province,Matale District,National schools,
Matale,Matale,"Zahira College, Matale",1AB,2088.0,Central Province,Matale District,National schools,
Matale,Matale,"Amina Girl's National School, Matale",1AB,2087.0,Central Province,Matale District,National schools,
Matale,Matale,"Pakkiyam National School, Matale",1AB,1649.0,Central Province,Matale District,National schools,
Matale,Matale,"Matale Hindu College, Matale",1AB,1429.0,Central Province,Matale District,National schools,
Matale,Ukuwela,"Ajmeer National School, Elakaduwa",1AB,1000.0,Central Province,Matale District,National schools,
Galewela,Dambulla,"Rangiri Dambulu National School, Dambulla",1AB,2555.0,Central Province,Matale District,National schools,
Galewela,Pallepola,"Weera Keppetipola Central College, Akuramboda",1AB,1408.0,Central Province,Matale District,National schools,
Naula,Naula,"Sri Naga National School, Naula",1AB,1562.0,Central Province,Matale District,National schools,
Matale,Matale,"Government Science College, Matale",1AB,857.0,Central Province,Matale District,Provincial schools,
Matale,Matale,"Vijayapala Maha Vidyalaya, Matale",1AB,2122.0,Central Province,Matale District,Provincial schools,
Matale,Yatawatta,"Weeraparakrama Secondary College, Yatawatta",1AB,1069.0,Central Province,Matale District,Provincial schools,
Matale,Rattota,"Kaikawala Central College, Kaikawla",1AB,1272.0,Central Province,Matale District,Provincial schools,
Galewela,Galewela,"Galewela Central College, Galewela",1AB,2108.0,Central Province,Matale District,Provincial schools,
Galewela,Pallepola,"Mahabodhi Secondary College, Pallepola",1AB,763.0,Central Province,Matale District,Provincial schools,
Wilgamuwa,Wilgamuwa,"Naminioya Central College, Naminioya",1AB,1701.0,Central Province,Matale District,Provincial schools,
Wilgamuwa,Laggala,"Haththotaamuna Maha Vidyalaya, Haththotaamuna",1AB,355.0,Central Province,Matale District,Provincial schools,
Matale,Matale,"Buddhagosha Maha Vidyalaya, Palapatwela",1C,820.0,Central Province,Matale District,Provincial schools,
Matale,Matale,"Madavala Ulpatha Secondary School, Madawala Ulapatha",1C,786.0,Central Province,Matale District,Provincial schools,
Matale,Matale,"Aluvihare Maha Vidyalaya, Aluvihare",1C,319.0,Central Province,Matale District,Provincial schools,
Matale,Matale,"Sujatha Balika Maha Vidyalaya, Kumbiyangoda",1C,827.0,Central Province,Matale District,Provincial schools,
Matale,Matale,"Sirimavo Bandaranayaka Model School, Matale",1C,1722.0,Central Province,Matale District,Provincial schools,
Matale,Matale,"Kalaimahal Maha Vidyalaya, Kawudupalella",1C,352.0,Central Province,Matale District,Provincial schools,
Matale,Rattota,"Bandarapola Maha Vidyalaya, Kiula",1C,639.0,Central Province,Matale District,Provincial schools,
Matale,Rattota,"Sri Parakrama Maha Vidyalaya, Rattota",1C,760.0,Central Province,Matale District,Provincial schools,
Matale,Rattota,"Sri Seevali Maha Vidyalaya, Weragama",1C,459.0,Central Province,Matale District,Provincial schools,
Matale,Rattota,"Dankanda Maha Vidyalaya, Dankanda",1C,334.0,Central Province,Matale District,Provincial schools,
Matale,Rattota,"Neluwakanda Buddhist School, Muwandeniya",1C,168.0,Central Province,Matale District,Provincial schools,
Matale,Rattota,"Rattota Hindu Maha Vidyalayam, Rattota",1C,717.0,Central Province,Matale District,Provincial schools,
Matale,Rattota,"Kandenuwara Tamil Maha Vidyalaya, Kandenuwara",1C,292.0,Central Province,Matale District,Provincial schools,
Matale,Ukuwela,"Ovilkanda Maha Vidyalaya, Ovilkanda",1C,300.0,Central Province,Matale District,Provincial schools,
Matale,Ukuwela,"Siddhartha Maha Vidyalaya, Nagolla",1C,337.0,Central Province,Matale District,Provincial schools,
Matale,Ukuwela,"Mahinda Rajapaksha Maha Vidyalaya, Ukuwela",1C,1042.0,Central Province,Matale District,Provincial schools,
Matale,Ukuwela,"Leliambe Maha Vidyalaya, Leliambe",1C,235.0,Central Province,Matale District,Provincial schools,
Matale,Ukuwela,"Thenna Maha Vidyalaya, Thenna",1C,247.0,Central Province,Matale District,Provincial schools,
Matale,Ukuwela,"Sri Saranankara Maha Vidyalaya, Udupihilla",1C,287.0,Central Province,Matale District,Provincial schools,
Matale,Ukuwela,"Annor Muslim Maha Vidyalaya, Warakamura",1C,683.0,Central Province,Matale District,Provincial schools,
Matale,Ukuwela,"Hameediya Muslim College, Kureewela",1C,1019.0,Central Province,Matale District,Provincial schools,
Matale,Ukuwela,"Elakaduwa Tamil Maha Vidyalayam, Elakaduwa",1C,422.0,Central Province,Matale District,Provincial schools,
Matale,Yatawatta,"Dullewa Maha Vidyalaya, Dullewa",1C,183.0,Central Province,Matale District,Provincial schools,
Matale,Yatawatta,"D.M Gunarathna Maha Vidyalaya, Mahawewa",1C,153.0,Central Province,Matale District,Provincial schools,
Matale,Yatawatta,"Anagarika Dharmapala Maha Vidyalaya, Udasgiriya",1C,349.0,Central Province,Matale District,Provincial schools,
Matale,Yatawatta,"Maliyadewa Maha Vidyalaya, Deevilla",1C,366.0,Central Province,Matale District,Provincial schools,
Matale,Yatawatta,"Minhaj Muslim Maha Vidyalaya, Nikagolla",1C,504.0,Central Province,Matale District,Provincial schools,
Galewela,Galewela,"Madipola Maha Vidyalaya, Madipola",1C,403.0,Central Province,Matale District,Provincial schools,
Galewela,Galewela,"Medabedda Maha Vidyalaya, Wahakotte",1C,692.0,Central Province,Matale District,Provincial schools,
Galewela,Galewela,"Mukulgaswewa Maha Vidyalaya, Dewahuwa",1C,401.0,Central Province,Matale District,Provincial schools,
Galewela,Galewela,"St. Anthoni's College, Wahakotte",1C,337.0,Central Province,Matale District,Provincial schools,
Galewela,Galewela,"Hombawa Maha Vidyalaya, Bambaragaswewa",1C,255.0,Central Province,Matale District,Provincial schools,
Galewela,Galewela,"Silwathgala Maha Vidyalaya, Beliyakanda",1C,358.0,Central Province,Matale District,Provincial schools,
Galewela,Galewela,"Moragolla Maha Vidyalaya, Bambaragaswewa",1C,286.0,Central Province,Matale District,Provincial schools,
Galewela,Galewela,"Tholambugolla Maha Vidyalaya, Tholambugolla",1C,810.0,Central Province,Matale District,Provincial schools,
Galewela,Galewela,"Al Furkhan Muslim Maha Vidyalaya, Namadagahawatta",1C,579.0,Central Province,Matale District,Provincial schools,
Galewela,Galewela,"Dewahuwa Muslim Maha Vidyalaya, Dewahuwa",1C,441.0,Central Province,Matale District,Provincial schools,
Galewela,Galewela,"Elamalpotha Muslim Maha Vidyalaya, Wahakotte",1C,262.0,Central Province,Matale District,Provincial schools,
Galewela,Galewela,"Keppetiya Muslim Maha Vidyalaya, Galewela",1C,375.0,Central Province,Matale District,Provincial schools,
Galewela,Dambulla,"Weera Mohan Jayamaha Maha Vidyalaya, Dambulla",1C,1625.0,Central Province,Matale District,Provincial schools,
Galewela,Dambulla,"D.S Senanayaka Maha Vidyalaya, Dambulla",1C,596.0,Central Province,Matale District,Provincial schools,
Galewela,Dambulla,"Thennakoon Maha Vidyalaya, Kandalama",1C,259.0,Central Province,Matale District,Provincial schools,
Galewela,Dambulla,"Sigiriya Maha Vidyalaya, Sigiriya",1C,822.0,Central Province,Matale District,Provincial schools,
Galewela,Dambulla,"Weera Wijaya Wimalarathna Maha Vidyalaya, Inamaluwa",1C,468.0,Central Province,Matale District,Provincial schools,
Galewela,Dambulla,"Thalakiriyagama Maha Vidyalaya, Thalakiriyagama",1C,600.0,Central Province,Matale District,Provincial schools,
Galewela,Dambulla,"Pannampitiya Maha Vidyalaya, Lenadora",1C,419.0,Central Province,Matale District,Provincial schools,
Galewela,Dambulla,"Wewalawewa Maha Vidyalaya, Wewalawewa",1C,399.0,Central Province,Matale District,Provincial schools,
Galewela,Dambulla,"Nikawatana Muslim Maha Vidyalaya, Nikawatana",1C,362.0,Central Province,Matale District,Provincial schools,
Galewela,Pallepola,"Maningamuwa Maha Vidyalaya, Maningamuwa",1C,238.0,Central Province,Matale District,Provincial schools,
Galewela,Pallepola,"Millawana Maha Vidyalaya, Millawana",1C,346.0,Central Province,Matale District,Provincial schools,
Galewela,Pallepola,"Arafa Muslim Maha Vidyalaya, Madipola",1C,473.0,Central Province,Matale District,Provincial schools,
Naula,Naula,"Montigopallawa Maha Vidyalaya, Koongahawela",1C,239.0,Central Province,Matale District,Provincial schools,
Naula,Naula,"Koongahawela Maha Vidyalaya, Koongahawela",1C,422.0,Central Province,Matale District,Provincial schools,
Naula,Naula,"Nalanda Maha Vidyalaya, Nalanda",1C,542.0,Central Province,Matale District,Provincial schools,
Naula,Naula,"Melpitiya Maha Vidyalaya, Melpitiya",1C,220.0,Central Province,Matale District,Provincial schools,
Naula,Naula,"Andawala Maha Vidyalaya, Madawala Ulpotha",1C,315.0,Central Province,Matale District,Provincial schools,
Naula,Naula,"Elagamuwa Maha Vidyalaya, Thalagoda Junction",1C,183.0,Central Province,Matale District,Provincial schools,
Naula,Ambanganga Korale,"Pussella Maha Vidyalya, Gammaduwa",1C,311.0,Central Province,Matale District,Provincial schools,
Naula,Ambanganga Korale,"Mahinda Secondary School, Matihakka",1C,230.0,Central Province,Matale District,Provincial schools,
Naula,Ambanganga Korale,"Gammaduwa Tamil Maha Vidyalayam, Gammaduwa",1C,280.0,Central Province,Matale District,Provincial schools,
Wilgamuwa,Wilgamuwa,"Maraka Maha Vidyalaya, Maraka",1C,662.0,Central Province,Matale District,Provincial schools,
Wilgamuwa,Wilgamuwa,"Handungamuwa Maha Vidyalaya, Handungamuwa",1C,389.0,Central Province,Matale District,Provincial schools,
Wilgamuwa,Wilgamuwa,"Nugagolla Maha Vidyalaya, Nugagolla",1C,537.0,Central Province,Matale District,Provincial schools,
Wilgamuwa,Laggala,"Minipura Wijaya Maha Vidyalaya, Haththotaamuna",1C,291.0,Central Province,Matale District,Provincial schools,
Wilgamuwa,Laggala,"Pallegama Maha Vidyalaya, Pallegama",1C,273.0,Central Province,Matale District,Provincial schools,
Wilgamuwa,Laggala,"Sri Sumana Maha Vidyalaya, Ilukkumbura",1C,155.0,Central Province,Matale District,Provincial schools,
Nuwara Eliya,Nuwara Eliya,"Gamini National School, Nuwara Eliya",1AB,1376.0,Central Province,Nuwara Eliya District,National schools,
Kotmale,Kotmale,"Jayahela National School, Pundaluoya",1AB,587.0,Central Province,Nuwara Eliya District,National schools,
Kotmale,Kotmale,"Gamini Dissanayake National School, Kotmale",1AB,1096.0,Central Province,Nuwara Eliya District,National schools,
Kotmale,Kotmale,"Al Minhaj National School, Hapugasthalawa",1AB,668.0,Central Province,Nuwara Eliya District,National schools,
Hanguranketha,Udahewahata,"Poramadulla Central College, Rikillagaskada",1AB,3401.0,Central Province,Nuwara Eliya District,National schools,
Hanguranketha,Udahewahata,"Victoria National School, Adhikarigama",1AB,687.0,Central Province,Nuwara Eliya District,National schools,
Walapane,Walapane,"Sri Sumangala National School, Nildandahinna",1AB,1437.0,Central Province,Nuwara Eliya District,National schools,
Nuwara Eliya,Nuwara Eliya,"Sumana Secondary School, Talawakale",1AB,553.0,Central Province,Nuwara Eliya District,Provincial schools,
Nuwara Eliya,Nuwara Eliya,"Good Shepherd's Balika Maha Vidyalaya, Nuwara Eliya",1AB,1629.0,Central Province,Nuwara Eliya District,Provincial schools,
Nuwara Eliya,Nuwara Eliya Tamil-1,"St. Xavier's College, Nuwara Eliya",1AB,715.0,Central Province,Nuwara Eliya District,Provincial schools,
Nuwara Eliya,Nuwara Eliya Tamil-1,"Holy Trinity College, Nuwara Eliya",1AB,1084.0,Central Province,Nuwara Eliya District,Provincial schools,
Nuwara Eliya,Nuwara Eliya Tamil-2,"Talawakelle Tamil Maha Vidyalayam, Talawakale",1AB,2123.0,Central Province,Nuwara Eliya District,Provincial schools,
Nuwara Eliya,Nuwara Eliya Tamil-2,"Kotagala Tamil Maha Vidyalayam, Kotagala",1AB,2530.0,Central Province,Nuwara Eliya District,Provincial schools,
Nuwara Eliya,Nuwara Eliya Tamil-2,"Cambridge College, Kotagala",1AB,782.0,Central Province,Nuwara Eliya District,Provincial schools,
Hatton,Ambagamuwa,"Ginigathena Central College, Ginigathena",1AB,1617.0,Central Province,Nuwara Eliya District,Provincial schools,
Hatton,Ambagamuwa,"Sri Pada Central College, Hatton",1AB,783.0,Central Province,Nuwara Eliya District,Provincial schools,
Hatton,Ambagamuwa,"St. Gabriel's Girls College, Hatton",1AB,1571.0,Central Province,Nuwara Eliya District,Provincial schools,
Hatton,Ambagamuwa,"Sri Nissankamalla Maha Vidyalaya, Hatton",1AB,225.0,Central Province,Nuwara Eliya District,Provincial schools,
Hatton,Ambagamuwa,"Laxapana Central College, Laxapana",1AB,482.0,Central Province,Nuwara Eliya District,Provincial schools,
Hatton,Ambagamuwa,"Ambagamuwa Central College, Ambagamuwa",1AB,706.0,Central Province,Nuwara Eliya District,Provincial schools,
Hatton,Hatton Tamil-1,"Highlands College, Hatton",1AB,2114.0,Central Province,Nuwara Eliya District,Provincial schools,
Hatton,Hatton Tamil-1,"St. John Bosco's College, Hatton",1AB,1655.0,Central Province,Nuwara Eliya District,Provincial schools,
Hatton,Hatton Tamil-3,"St. Joseph's College, Maskeliya",1AB,1090.0,Central Province,Nuwara Eliya District,Provincial schools,
Kotmale,Kotmale,"Hedunuwewa Central College, Hatton",1AB,,Central Province,Nuwara Eliya District,Provincial schools,
Kotmale,Kotmale,"Harangala Central College, Nawalapitiya",1AB,742.0,Central Province,Nuwara Eliya District,Provincial schools,
Kotmale,Kotmale,"Delta Gemunupura College, Pussellawa",1AB,1315.0,Central Province,Nuwara Eliya District,Provincial schools,
Kotmale,Kotmale,"Weerasekara Secondary School, Katukithula",1AB,419.0,Central Province,Nuwara Eliya District,Provincial schools,
Kotmale,Kotmale,"Pundaluoya Tamil Maha Vidyalayam, Pundaluoya",1AB,1654.0,Central Province,Nuwara Eliya District,Provincial schools,
Hanguranketha,Udahewahata,"Pallebowewa Maha Vidyalaya, Pallebowewa",1AB,870.0,Central Province,Nuwara Eliya District,Provincial schools,
Hanguranketha,Udahewahata,"Diyathilaka Central College, Hanguranketha",1AB,1431.0,Central Province,Nuwara Eliya District,Provincial schools,
Hanguranketha,Udahewahata,"Sirimavo Bandaranayaka Girls College, Hanguranketha",1AB,749.0,Central Province,Nuwara Eliya District,Provincial schools,
Hanguranketha,Udahewahata,"Denike Secondary School, Rikillagaskada",1AB,1797.0,Central Province,Nuwara Eliya District,Provincial schools,
Walapane,Walapane,"Pussadewa Central College, Batagolla",1AB,633.0,Central Province,Nuwara Eliya District,Provincial schools,
Walapane,Walapane,"T.B.M Herath Secondary School, Halgranoya",1AB,1201.0,Central Province,Nuwara Eliya District,Provincial schools,
Walapane,Walapane,"Ragala Tamil Maha Vidyalayam, Ragala",1AB,1232.0,Central Province,Nuwara Eliya District,Provincial schools,
Nuwara Eliya,Nuwara Eliya,"Lindula Sinhala Maha Vidyalaya, Lindula",1C,195.0,Central Province,Nuwara Eliya District,Provincial schools,
Nuwara Eliya,Nuwara Eliya,"Sri Vajiragana Maha Vidyalaya, Hawaeliya",1C,349.0,Central Province,Nuwara Eliya District,Provincial schools,
Nuwara Eliya,Nuwara Eliya,"Agarapatana Sinhala Maha Vidyalaya, Agarapatana",1C,320.0,Central Province,Nuwara Eliya District,Provincial schools,
Nuwara Eliya,Nuwara Eliya,"Paynter Memorial School, Nuwara Eliya",1C,412.0,Central Province,Nuwara Eliya District,Provincial schools,
Nuwara Eliya,Nuwara Eliya,"Mahinda Maha Vidyalaya, Kandapola",1C,225.0,Central Province,Nuwara Eliya District,Provincial schools,
Nuwara Eliya,Nuwara Eliya,"Sri Senananda Maha Vidyalaya, Meepilimana",1C,588.0,Central Province,Nuwara Eliya District,Provincial schools,
Nuwara Eliya,Nuwara Eliya,"Girls High School, Nuwara Eliya",1C,653.0,Central Province,Nuwara Eliya District,Provincial schools,
Nuwara Eliya,Nuwara Eliya,"Kikiliyamana Maha Vidyalaya, Labukele",1C,362.0,Central Province,Nuwara Eliya District,Provincial schools,
Nuwara Eliya,Nuwara Eliya Tamil-1,"St. Coom's Maha Vidyalayam, Thalawakele",1C,847.0,Central Province,Nuwara Eliya District,Provincial schools,
Nuwara Eliya,Nuwara Eliya Tamil-1,"Good Rest Balika Maha Vidyalayam, Nuwaraeliya",1C,761.0,Central Province,Nuwara Eliya District,Provincial schools,
Nuwara Eliya,Nuwara Eliya Tamil-1,"Methodist College, Kandhapola",1C,1028.0,Central Province,Nuwara Eliya District,Provincial schools,
Nuwara Eliya,Nuwara Eliya Tamil-1,"Dess Ford Tamil Maha Vidyalayam, Nanuoya",1C,501.0,Central Province,Nuwara Eliya District,Provincial schools,
Nuwara Eliya,Nuwara Eliya Tamil-1,"Nawlar Tamil Maha Vidyalayam, Nanuoya",1C,776.0,Central Province,Nuwara Eliya District,Provincial schools,
Nuwara Eliya,Nuwara Eliya Tamil-2,"Saraswati Tamil Maha Vidyalayam, Lindula",1C,825.0,Central Province,Nuwara Eliya District,Provincial schools,
Nuwara Eliya,Nuwara Eliya Tamil-2,"Watagoda Tamil Maha Vidyalayam, Watagoda",1C,854.0,Central Province,Nuwara Eliya District,Provincial schools,
Nuwara Eliya,Nuwara Eliya Tamil-2,"Dimbula Tamil Maha Vidyalayam, Patana",1C,525.0,Central Province,Nuwara Eliya District,Provincial schools,
Nuwara Eliya,Nuwara Eliya Tamil-2,"St. Clair Tamil Maha vidyalayam, Thalawakele",1C,542.0,Central Province,Nuwara Eliya District,Provincial schools,
Nuwara Eliya,Nuwara Eliya Tamil-2,"Ythanside Tamil Maha Vidyalayam, Kotagala",1C,492.0,Central Province,Nuwara Eliya District,Provincial schools,
Nuwara Eliya,Nuwara Eliya Tamil-2,"Barathi Tamil Maha Vidyalayam, Thalawakele",1C,683.0,Central Province,Nuwara Eliya District,Provincial schools,
Nuwara Eliya,Nuwara Eliya Tamil-3,"Holbrook Tamil Maha Vidyalayam, Agarapatana",1C,1077.0,Central Province,Nuwara Eliya District,Provincial schools,
Nuwara Eliya,Nuwara Eliya Tamil-3,"Agarapatana Tamil Maha Vidyalayam, Agarapatana",1C,743.0,Central Province,Nuwara Eliya District,Provincial schools,
Nuwara Eliya,Nuwara Eliya Tamil-3,"Dayagama West Tamil Maha Vidyalayam, Dayagama",1C,766.0,Central Province,Nuwara Eliya District,Provincial schools,
Nuwara Eliya,Nuwara Eliya Tamil-3,"Maria Tamil Maha Vidyalayam, Lindula",1C,1099.0,Central Province,Nuwara Eliya District,Provincial schools,
Hatton,Ambagamuwa,"Noorwood Sinhala Maha Vidyalaya, Noorwood",1C,170.0,Central Province,Nuwara Eliya District,Provincial schools,
Hatton,Ambagamuwa,"Samaneliya Maha Vidyalaya, Maskeliya",1C,379.0,Central Province,Nuwara Eliya District,Provincial schools,
Hatton,Ambagamuwa,"Vidulipura Maha Vidyalaya, Vidulipura",1C,376.0,Central Province,Nuwara Eliya District,Provincial schools,
Hatton,Ambagamuwa,"Kalugala Maha Vidyalaya, Pitawala",1C,684.0,Central Province,Nuwara Eliya District,Provincial schools,
Hatton,Ambagamuwa,"Kalaweldeniya Maha Vidyalaya, Ginigathena",1C,143.0,Central Province,Nuwara Eliya District,Provincial schools,
Hatton,Ambagamuwa,"Madeniya Maha Vidyalaya, Hitigegama",1C,230.0,Central Province,Nuwara Eliya District,Provincial schools,
Hatton,Ambagamuwa,"Morahenagama Maha Vidyalaya, Morahenagama",1C,253.0,Central Province,Nuwara Eliya District,Provincial schools,
Hatton,Ambagamuwa,"Dharmakeerthi Maha Vidyalaya, Bogawanthalawa",1C,211.0,Central Province,Nuwara Eliya District,Provincial schools,
Hatton,Hatton Tamil-1,"Abbotsliegh Tamil Maha Vidyalayam, Hatton",1C,544.0,Central Province,Nuwara Eliya District,Provincial schools,
Hatton,Hatton Tamil-1,"Shannon Tamil Maha Vidyalayam, Hatton",1C,828.0,Central Province,Nuwara Eliya District,Provincial schools,
Hatton,Hatton Tamil-1,"Watawala Tamil Maha Vidyalyam, Watawala",1C,715.0,Central Province,Nuwara Eliya District,Provincial schools,
Hatton,Hatton Tamil-1,"Vigneshwara Tamil Maha Vidyalayam, Kandawala",1C,566.0,Central Province,Nuwara Eliya District,Provincial schools,
Hatton,Hatton Tamil-1,"Pulliyawatta Tamil Maha Vidyalayam, Dickoya",1C,990.0,Central Province,Nuwara Eliya District,Provincial schools,
Hatton,Hatton Tamil-1,"Dickoya Tamil Maha Vidyalayam, Dickoya",1C,502.0,Central Province,Nuwara Eliya District,Provincial schools,
Hatton,Hatton Tamil-1,"Carfax Tamil Maha Vidyalayam, Hatton",1C,432.0,Central Province,Nuwara Eliya District,Provincial schools,
Hatton,Hatton Tamil-1,"Annfield Tamil Maha Vidyalayam, Dickoya",1C,695.0,Central Province,Nuwara Eliya District,Provincial schools,
Hatton,Hatton Tamil-1,"Kuilwatta Tamil Maha Vidyalayam, Rosella",1C,372.0,Central Province,Nuwara Eliya District,Provincial schools,
Hatton,Hatton Tamil-2,"St. Mary's Central College, Bogawanthalawa",1C,1665.0,Central Province,Nuwara Eliya District,Provincial schools,
Hatton,Hatton Tamil-2,"Holy Rosary Maha Vidyalayam, Bogawanthalawa",1C,835.0,Central Province,Nuwara Eliya District,Provincial schools,
Hatton,Hatton Tamil-2,"Noorwood Tamil Maha Vidyalayam, Noorwood",1C,1311.0,Central Province,Nuwara Eliya District,Provincial schools,
Hatton,Hatton Tamil-2,"Tientsin Tamil Maha Vidyalayam, Bogawanthalawa",1C,542.0,Central Province,Nuwara Eliya District,Provincial schools,
Hatton,Hatton Tamil-2,"Campion Tamil Maha Vidyalayam, Bogawanthalawa",1C,557.0,Central Province,Nuwara Eliya District,Provincial schools,
Hatton,Hatton Tamil-3,"Ganapathi Tamil Maha Vidyalayam, Norton Bridge",1C,414.0,Central Province,Nuwara Eliya District,Provincial schools,
Hatton,Hatton Tamil-3,"Nallathaneer Tamil Maha Vidyalayam, Maskeliya",1C,591.0,Central Province,Nuwara Eliya District,Provincial schools,
Hatton,Hatton Tamil-3,"Luccombe Tamil Maha Vidyalayam, Maskeliya",1C,516.0,Central Province,Nuwara Eliya District,Provincial schools,
Hatton,Hatton Tamil-3,"Bloomfield Tamil Maha Vidyalayam, Maskeliya",1C,1058.0,Central Province,Nuwara Eliya District,Provincial schools,
Hatton,Hatton Tamil-3,"Gouravilla Tamil Maha Vidyalayam, Upcot",1C,937.0,Central Province,Nuwara Eliya District,Provincial schools,
Kotmale,Kotmale,"Gamunu Maha Vidyalaya, Maswela",1C,203.0,Central Province,Nuwara Eliya District,Provincial schools,
Kotmale,Kotmale,"Maldeniya Maha Vidyalaya, Maldeniya",1C,314.0,Central Province,Nuwara Eliya District,Provincial schools,
Kotmale,Kotmale,"Sri Parakrama Maha Vidyalaya, Madakumbura",1C,219.0,Central Province,Nuwara Eliya District,Provincial schools,
Kotmale,Kotmale,"Sirigama Maha Vidyalaya, Gorakaoya",1C,496.0,Central Province,Nuwara Eliya District,Provincial schools,
Kotmale,Kotmale,"Nayapana Maha Vidyalaya, Nayapana Janapadaya",1C,604.0,Central Province,Nuwara Eliya District,Provincial schools,
Kotmale,Kotmale,"Rojarsangama Maha Vidyalaya, Rojarsangama",1C,528.0,Central Province,Nuwara Eliya District,Provincial schools,
Kotmale,Kotmale,"Sri Buddharaja Maha Vidyalaya, Nawa Thispane",1C,615.0,Central Province,Nuwara Eliya District,Provincial schools,
Kotmale,Kotmale,"Ananda Dassanayaka Maha Vidyalaya, Hunugaloya",1C,293.0,Central Province,Nuwara Eliya District,Provincial schools,
Kotmale,Kotmale,"Kahira Muslim Maha Vidyalaya, Ahaswewa",1C,215.0,Central Province,Nuwara Eliya District,Provincial schools,
Kotmale,Kotmale,"Hindu Vidyalayam, Ramboda",1C,434.0,Central Province,Nuwara Eliya District,Provincial schools,
Kotmale,Kotmale,"Viveganantha Tamil Maha Vidyalayam, Pundaluoya",1C,597.0,Central Province,Nuwara Eliya District,Provincial schools,
Kotmale,Kotmale,"Kataboola Tamil Maha Vidyalayam, Kataboola",1C,481.0,Central Province,Nuwara Eliya District,Provincial schools,
Kotmale,Kotmale,"Vigneswara Tamil Maha Vidyalayam, Helboda",1C,488.0,Central Province,Nuwara Eliya District,Provincial schools,
Kotmale,Kotmale,"Labukella Tamil Maha Vidyalayam, Labukella",1C,480.0,Central Province,Nuwara Eliya District,Provincial schools,
Kotmale,Kotmale,"Dunsinane Tamil Maha Vidyalayam, Pundaluoya",1C,607.0,Central Province,Nuwara Eliya District,Provincial schools,
Kotmale,Kotmale,"Eyrie Tamil Maha Vidyalayam, Ramboda",1C,482.0,Central Province,Nuwara Eliya District,Provincial schools,
Hanguranketha,Udahewaheta,"Gangapalatha Maha Vidyalaya, Gonagathenna",1C,221.0,Central Province,Nuwara Eliya District,Provincial schools,
Hanguranketha,Udahewaheta,"Vidyakara Maha Vidyalaya, Poramadulla",1C,1507.0,Central Province,Nuwara Eliya District,Provincial schools,
Hanguranketha,Udahewaheta,"Padiyapelalla Secondary School, Padiyapelalla",1C,484.0,Central Province,Nuwara Eliya District,Provincial schools,
Hanguranketha,Udahewaheta,"Mathurata Maha Vidyalaya, Mathurata",1C,779.0,Central Province,Nuwara Eliya District,Provincial schools,
